{
  "from": "2026-08-01T12:00:00Z",
  "to": "2026-08-01T14:00:00Z",
  "truncated": false,
  "sampledExecutions": 2,
  "totals": {
    "executions": 2,
    "completed": 2,
    "failed": 0,
    "completionRate": 1,
    "averageQuality": 0.94,
    "inputTokens": 920,
    "outputTokens": 280,
    "cost": 0.024,
    "averageLatencyMilliseconds": 640,
    "modelCalls": 1,
    "toolCalls": 0,
    "noModelResolutions": 1,
    "modelCallsAvoided": 1
  },
  "groups": [
    {
      "taskType": "email.draft",
      "policyVersion": "routing.w18.v1",
      "metrics": {
        "executions": 2,
        "completed": 2,
        "failed": 0,
        "completionRate": 1,
        "averageQuality": 0.94,
        "inputTokens": 920,
        "outputTokens": 280,
        "cost": 0.024,
        "averageLatencyMilliseconds": 640,
        "modelCalls": 1,
        "toolCalls": 0,
        "noModelResolutions": 1,
        "modelCallsAvoided": 1
      }
    }
  ],
  "memory": {
    "considered": 2,
    "accepted": 1,
    "rejected": 1,
    "hitRate": 0.5,
    "resolvers": [
      {
        "resolver": "exact-cache",
        "considered": 2,
        "accepted": 1,
        "rejected": 1,
        "reasons": {
          "exact_cache_hit": 1,
          "exact_cache_miss": 1
        }
      }
    ]
  },
  "recentExecutions": [
    {
      "executionId": "019883a0-7b00-7000-8000-000000000013",
      "taskType": "email.draft",
      "policyVersion": "routing.w18.v1",
      "status": "Succeeded",
      "startedAt": "2026-08-01T13:45:00Z",
      "durationMilliseconds": 640,
      "resolutionLevel": "SmallModel",
      "quality": 0.94,
      "cost": 0.024,
      "inputTokens": 920,
      "outputTokens": 280
    }
  ],
  "gatewayGroups": [
    {
      "gatewayId": "gateway-eu",
      "provider": "gateway-operator-a",
      "deploymentId": "generation-small-v1",
      "region": "westeurope",
      "modelVersion": "2026-08",
      "failureClass": "Throttling",
      "circuitState": "Closed",
      "metrics": {
        "attempts": 1,
        "successes": 0,
        "failures": 1,
        "rejectedCandidates": 0,
        "fallbacks": 0,
        "averageLatencyMilliseconds": 42
      }
    },
    {
      "gatewayId": "gateway-eu-fallback",
      "provider": "gateway-operator-b",
      "deploymentId": "generation-strong-v1",
      "region": "northeurope",
      "modelVersion": "2026-07",
      "failureClass": null,
      "circuitState": "Closed",
      "metrics": {
        "attempts": 1,
        "successes": 1,
        "failures": 0,
        "rejectedCandidates": 0,
        "fallbacks": 1,
        "averageLatencyMilliseconds": 800
      }
    }
  ]
}
